User Input,Chatbot Response,Timestamp
Hi,"Hello, I am FoodieGenie! How can I assist you with your food order today?",2025-01-05 14:38:12
I want to order food,What would you like to have? We offer a variety of dishes.,2025-01-05 14:38:40
Order Pizza,"Okay, {food_name} is added to your order. Any other requests?",2025-01-05 14:39:09
Place the order,Your order is confirmed!,2025-01-05 14:40:10
What’s your name?,Why don’t chefs trust each other? Because they keep too many secrets!,2025-01-05 14:40:35
How to stay healthy,"Hello! I'm FoodieGenie, your personal dining assistant. What can I do for you today?",2025-01-05 14:41:05
Thanks,No problem,2025-01-05 14:41:30
